web-scraper-order,web-scraper-start-url,profesoresurl,profesoresurl-href,review,nota
"1576029012-5157","https://losestudiantes.co/","Diego Valderrama RojasAdministración","https://losestudiantes.co/universidad-de-los-andes/administracion/profesores/diego-valderrama-rojas","La clase tiene temas muy interesantes, el profesor es muy claro y siempre va a estar abierto a responder cualquier pregunta. Tiene excelentes herramientas visuales como apoyo y las sube a Sicua, nunca pregunta nada que no se haya mencionado y explicado en clase. La gente que dice que los quices son difíciles es porque son vagos y no asisten a la cl...
Leer más...Pros: Temas muy interesantes
Tiene mucho conocimiento
Plantea cuestionamientos interesantesCons: Va rápido entonces toca estar atento siempre","4.5"
"1576028936-4828","https://losestudiantes.co/","Rodrigo Taborda RiosAdministración","https://losestudiantes.co/universidad-de-los-andes/administracion/profesores/rodrigo-taborda-rios","para herramientas 1. el 70 % son talleres pa la casa, es decir que es muy facil pasar y hasta dejar alta. no hay asistencia no hay necesidad de ir a clase. El man es un bacan de verdad pero el tema no es tan facil de entenderPros: 70% talleres","3.9"
"1576028969-5023","https://losestudiantes.co/","Luz Stella Bernal VargasAdministración","https://losestudiantes.co/universidad-de-los-andes/administracion/profesores/luz-stella-bernal-vargas","Pros: Excelente ser humano
Flexible con el programa
Actividades entretenidas
La clase permite mucha interacción entre los estudiantes
Las lecturas son buenísimas 
Las charlas TED y las películas también son muy relevantesCons: Clase a las 6:30 viernes
Los diarios se pueden tornar tediosos
El grupo para la exposición es aleatorio y si le toca con gente vaga, termina haciendo toda la presentación como yo","4.8"
"1576028856-4444","https://losestudiantes.co/","Jorge Ricardo Barriga PalacioAdministración","https://losestudiantes.co/universidad-de-los-andes/administracion/profesores/jorge-ricardo-barriga-palacio","Dios es la clase más dura del mundo. En realidad debería tener como 9 créditos. Cuando la ví tenía media matrícula y casi no la logro fue muy muy duro tipo (nos reuníamos con mi grupo los domingos a trabajar y aún así aunque sacábamos notas altas en comparación al resto de nuestros compañeros, estas nunca superaron un 4) . Esta es una clase para la...
Leer más...","4"
"1576028812-4255","https://losestudiantes.co/","Rosa Isabel Gonzalez MuñozAdministración","https://losestudiantes.co/universidad-de-los-andes/administracion/profesores/rosa-isabel-gonzalez-mu%C3%B1oz","Rosita no es tan mala como le hacen fama, sinceramente. Es una profesora que sabe demasiado del tema que explica, haciendo presentaciones concisas para que las personas entiendan el tema. Ahora bien, las personas sensibles no se deben dejar tocar por lo que diga. Es una persona seria, que se toma en serio su profesión y por tanto, no le gusta que irrespeten su trabajo habalndo al frente de ella y llegando una hora tarde a clase. Así que sí, posiblemente uno se gane una regañada o coemntario sarcástico pero no es para tanto. (en serio)Las tareas son largas, aunque no tanto como antes, lo malo es que toca hacerlas a mano. Lo bueno es que uno termina sabiendo mucho más que otras secciones, al ser exigido más y termina más preparado. No le gusta que pregunten cosas que uno debió hacer antes, pero sus horarios de atención están abiertos siempre y es muy querida. No teman, ni crean tampoco una fama de una mujer que es seria y sarcástica.Pros: Pros: 
Presentaciones muy buenas
Explica muy bien 
Uno termina muy preparado
Buenos horarios de atención, abierta a todoCons: COns: 
Si usted no aguanta un comentario sarcástico, no meta con ella. 
Tareas un poco largas","3.9"
"1576028948-4894","https://losestudiantes.co/","Martha Elizabeth Garavito SuarezAdministración","https://losestudiantes.co/universidad-de-los-andes/administracion/profesores/martha-elizabeth-garavito-suarez","Vi historia del desarrollo empresarial con Martha. Creo que este semestre fue distinto a los demás en cuanto a la forma en que la profesora dio la clase porque en realidad la encontré muy agradable, fue mi clase favorita. Es una clase pesada porque hay que trabajar duro pero realmente los temas son muy interesantes y la profesora tiene un amplio conocimiento. Sí recomiendo meter la clase con ella, van a aprender mucho y si le dedican tiempo seguro les va a ir muy bien porque no es para nada difícil. Pros: Se aprende demasiado en la claseCons: Quices sorpresa que valen un gran porcentaje en la nota final
Las reseñas implican mucho trabajo y no valen tanto en la nota final.","4"
"1576029062-5366","https://losestudiantes.co/","Juan Pablo Castillo GutierrezAdministración","https://losestudiantes.co/universidad-de-los-andes/administracion/profesores/juan-pablo-castillo-gutierrez","Es muy bueno, si puedan metan con él. Pros: Su clase es muy útil y aprendes cosas que realmente te van a servir
No es difícil, es de ponerle ganas y hacer los trabajos 
Gran gran profesor","4.7"
"1576028936-4835","https://losestudiantes.co/","Rodrigo Taborda RiosAdministración","https://losestudiantes.co/universidad-de-los-andes/administracion/profesores/rodrigo-taborda-rios","Rodrigo es un muy buen profesor, es una buena persona y te ayuda mucho cuando vas a su oficina a preguntar por dudas de los talleres. Los talleres que deja son acordes a lo que explica en clase y no califica tan duro, pero es exigente. Sus clases son muy divertidas y entretenidas. Pros: Explica muy bien, hace la clase muy amena y ayuda mucho para los talleres.Cons: A veces es muy distraido, entonces no alcanza a explicar todo el tema en clase.","4.5"
"1576028889-4598","https://losestudiantes.co/","Oleg KonovalovAdministración","https://losestudiantes.co/universidad-de-los-andes/administracion/profesores/oleg-konovalov","Oleg es una excelente persona que muestra que ama lo que hace y que siempre intenta dar algo de si para que los estudiantes aprecien su clase. Sin embargo, por mas apasionado que sea, no logra captar la atencion de los estudiantes, lo cual resulta en la clase mas aburrida y larga de la historia. Son 3 horas de clase en las cuales no se hace nada mas que perder el tiempo y trabajar en un proyecto que es poco interesante y poco creativo para ser sincero. Esta clase llegaba a ser tan tediosa que la gente simplemente se salia o se inventaba excusas para irse. Es fácil de dejar alta pero es realmente inútil y no aporto nada para mi vida. Pros: Facil de dejar alta
Apasionado por lo que haceCons: 3 horas de vida perdidas a la semana.","2"
"1576028884-4585","https://losestudiantes.co/","Catalina Estrada MejiaAdministración","https://losestudiantes.co/universidad-de-los-andes/administracion/profesores/catalina-estrada-mejia","Es de las mejores profesoras que he tenido. A parte de que explica muy bien los temas en clase es una muy buena persona y muy amable con sus estudiantes. Deja bastantes talleres pero todos son basados en los temas de clase.","5"
"1576028824-4320","https://losestudiantes.co/","Carlos Davila Ladron De GuevaraAdministración","https://losestudiantes.co/universidad-de-los-andes/administracion/profesores/carlos-davila-ladron-de-guevara","Esta clase fue un reto, y eso me dejó muy satisfecho. En ciertos momentos uno se desesperaba con la metodología tan 'escuelera' de la clase, pero viendo en retrospectiva semestres después, esta clase tuvo un impacto muy positivo en mi desarrollo.","5"
"1576029062-5376","https://losestudiantes.co/","Juan Pablo Castillo GutierrezAdministración","https://losestudiantes.co/universidad-de-los-andes/administracion/profesores/juan-pablo-castillo-gutierrez","Muy buen profesor, vale la pena madrugar por todo lo que se aprende. No es nada tedioso.Pros: Da una perspectiva laboral de lo que se aprende. Cons: A veces tiene comentarios un poco machistas.","5"
"1576029039-5270","https://losestudiantes.co/","David Schnarch GonzalezAdministración","https://losestudiantes.co/universidad-de-los-andes/administracion/profesores/david-schnarch-gonzalez","Le apasiona lo que hace, es claro al enseñar y en general es muuuy buen profesor. No hace curvas ni nada por el esCons: Es necesario leer, de lo contrario té saca de clase","4.7"
"1576028853-4420","https://losestudiantes.co/","Jose Camilo Davila Ladron de GuevaraAdministración","https://losestudiantes.co/universidad-de-los-andes/administracion/profesores/jose-camilo-davila-ladron-de-guevara","Excelente profesor. Sabe mucho y se le nota la pasión sobre el tema.Cons: puede ser un poco duro a la hora de calificar.","4"
"1576028922-4766","https://losestudiantes.co/","Sonia Marcela Camacho AhumadaAdministración","https://losestudiantes.co/universidad-de-los-andes/administracion/profesores/sonia-marcela-camacho-ahumada","Es una excelente profesora. Se esfuerza para que uno aprenda. Es super querida","5"
"1576028821-4294","https://losestudiantes.co/","Maria Alejandra Velez LesmesAdministración","https://losestudiantes.co/universidad-de-los-andes/administracion/profesores/maria-alejandra-velez-lesmes","No enseña nada que tenga que ver en administración y toda su clase podría ser un curso de ciencia política. Es ideologa y altamente sesgada. Despectiva con las personas que van en contra de sus posiciones.Cons: Muchas lecturas, incluye muchas más páginas de las necesarias para entender el concepto. Lecturas, tareas y quices casi todas las clases.","1.5"
"1576028924-4771","https://losestudiantes.co/","Marco Antonio Azuero IsazaAdministración","https://losestudiantes.co/universidad-de-los-andes/administracion/profesores/marco-antonio-azuero-isaza","Es muy bueno, bastante didactico, los ejercicios son geniales. Se deja hablar, todo se puede negociar, es un tipo chevere, el monitor ayuda mucho y la mayoría de reglas están claras desde el principio.","4.5"
"1576028880-4553","https://losestudiantes.co/","Luis Fernando Molina LondonoAdministración","https://losestudiantes.co/universidad-de-los-andes/administracion/profesores/luis-fernando-molina-londono","Es un gran profesor, hace que los estudiantes se interesen por la clase y además es muy chistoso. Toca leer, pero los temas son muy interesantes y se aprende. Es un poco escuelero y su profesora asistente es lo peor.","5"
"1576029012-5160","https://losestudiantes.co/","Diego Valderrama RojasAdministración","https://losestudiantes.co/universidad-de-los-andes/administracion/profesores/diego-valderrama-rojas","excelente profesorPros: es muy apasionado y aprendes mucho Cons: Aveces puede ser may parcial con sus pensamientos o posiciones sobre algunos temas.","4.6"
"1576028902-4681","https://losestudiantes.co/","Rafael De Jesus Bautista MenaAdministración","https://losestudiantes.co/universidad-de-los-andes/administracion/profesores/rafael-de-jesus-bautista-mena","Jamás meta una clase con Rafael. Es el peor profesor del mundo, simplemente no nació para la educación. Además de ser supremamente grosero con sus comentarios en clase, no enseña absolutamente nada. Jura que su materia es lo único que uno ve en el semestre. De proyecto final nos dejó una proyección a 10 años de una empresa y faltaban documentos, le escribimos al correo.... Y SEGUIMOS ESPERANDO. Los parciales no miden el conocimiento ya que yo sintiendo que no he aprendido absolutamente nada, me he sacado notas de 4 en los parciales. Hágase un favor y no meta clase con él, ES UNA TRAMPAPros: NINGUNOCons: TODOS","1.5"
"1576028817-4281","https://losestudiantes.co/","Oscar Francisco Trujillo ReyesAdministración","https://losestudiantes.co/universidad-de-los-andes/administracion/profesores/oscar-francisco-trujillo-reyes","excelente profesor","5"
"1576028875-4541","https://losestudiantes.co/","Xavier Hernando Duran AmorochoAdministración","https://losestudiantes.co/universidad-de-los-andes/administracion/profesores/xavier-hernando-duran-amorocho","Es un profesor con muchísimo conocimiento, divertido, que hace la clase un espacio para que los estudiantes aprendan en serio acerca de la Historia Empresarial Colombiana, tanto así que terminen apreciando la clase y sus temas. Las lecturas exigidas son muy interesantes, pero a veces muy extensas, de manera que puede dar pereza leerlas. Hay que leerlas, en todo caso, porque la participación es a ""dedocracia"" y si te preguntan y no sabes, te baja una unidad. SIn embargo, puedo confesar que es el mejor profesor para la materia, excelente en verdad. 
Muy recomendadoPros: Pros: 
Todo
- El mejor profesor para la materia. Cons: Cons: 
Si no se lee, no se aprenderá nada y le irá mal.
- Para un CBU, requiere de tiempo. Si tiene ese tiempo, será muy muy valioso lo que aprenda.","5"
"1576029006-5137","https://losestudiantes.co/","Ernesto Cuellar UrbanoAdministración","https://losestudiantes.co/universidad-de-los-andes/administracion/profesores/ernesto-cuellar-urbano","Ernesto es un profesor que siempre está dispuesto a escuchar a sus estudiantes. La dinámica de la clase me parece buena pero para aprender uno debe ser muy autodidacta ya que en la mayoría del tiempo hay presentaciones de los temas del curso hechas por los estudiantes. Considero que la dinámica de tener muchos casos de Harvard a lo largo del semestre, realizar una preparación y luego una discusión en clase motiva mucho el hecho de aprender y entender los temas, pero no se aprovecha mucho ya que casi siempre las discusiones son de máximo 5 personas participando activamente y el profesor. 
La participación y la asistencia a clase son muy importantes porque se realizan muchos quices a lo largo del semestre
En términos generales la clase es muy fácil y no es difícil de dejar en 5 ya que Ernesto tiende a aproximar a 5 siempre y cuando la nota final sea mayor a 4,7.Pros: Fácil
El profesor sabe mucho del tema
Muchos casos a lo largo del semestre para aplicar los conceptos de la claseCons: Aunque el profesor sabe mucho del tema, casi nunca da clase.","4"
"1576028954-4927","https://losestudiantes.co/","Alejandro Castillo VallejoAdministración","https://losestudiantes.co/universidad-de-los-andes/administracion/profesores/alejandro-castillo-vallejo","Pros: Toca trabajar pero es excelente profesor, las clases son interesantes y es fácil dejarla muy alta","5"
"1576028906-4703","https://losestudiantes.co/","Carlos Andres Rodriguez CortesAdministración","https://losestudiantes.co/universidad-de-los-andes/administracion/profesores/carlos-andres-rodriguez-cortes","Puede que no explique todos los temas en clase, por lo que le toca estudiar por su cuenta, sin embargo, lo que explica se le entiende muy bien. Deja tareas que te permiten entender los temas, hubo un parcial que estuvo un poco largo para el tiempo que se nos dió. No es difícil dejar la materia por encima de 4.5. Si te ve hablando, o con el celular te regaña.Pros: Materia fácil de dejar alta
Es comprensivo
Últimamente el examen final ha sido en parejasCons: Le falta temas por explicar
Parciales un poco largos
Le gusta el auto-aprendizaje","4.4"
"1576029039-5285","https://losestudiantes.co/","David Schnarch GonzalezAdministración","https://losestudiantes.co/universidad-de-los-andes/administracion/profesores/david-schnarch-gonzalez","Pros: FacilCons: Clase aburrida","3.5"
"1576028997-5090","https://losestudiantes.co/","Martha Constanza Caceres PorrasAdministración","https://losestudiantes.co/universidad-de-los-andes/administracion/profesores/martha-constanza-caceres-porras","Pros: Explica muy bienCons: Parciales largos","5"
"1576028915-4740","https://losestudiantes.co/","Gabriel Perez CifuentesAdministración","https://losestudiantes.co/universidad-de-los-andes/administracion/profesores/gabriel-perez-cifuentes","Es un profesor muy tierno y querido, no se enfoca en el libro sino en su experiencia en el campo del marketing, sus clases son interesantes y los parciales aun mas. Da bonos por todo. Si quieres aprender lee el libro porque en general es una materia muy facil","4.3"
"1576028939-4844","https://losestudiantes.co/","Juliana Malagon PenenAdministración","https://losestudiantes.co/universidad-de-los-andes/administracion/profesores/juliana-malagon-penen","Juliana es muy buena explicando, si uno va a todas las clases es casi seguro pasar la materia. Pros: La clase es entretenida.
Juliana se preocupa por que el grupo vaya aprendiendo según avanza el programa.
Los parciales son fáciles. Cons: Hace quices sorpresa","5"
"1576028997-5105","https://losestudiantes.co/","Martha Constanza Caceres PorrasAdministración","https://losestudiantes.co/universidad-de-los-andes/administracion/profesores/martha-constanza-caceres-porras","Excelente profesora. Sumamente esquemática y conceptual con la forma de enseñar, pero sin duda, al asistir a la clase, y habiendo revisado el material que a uno le designan para cada sesión, se aprende en un 100%. De hecho, los parciales en efecto reflejan todos los temas tratados (ni uno más ni uno menos), y uno termina aprendiendo bastante de exc...
Leer más...Pros: Muy clara, muy concisa con una metodología muy efectiva.
No es descomunal la carga de trabajo, pues con un taller y un reto semanal bastante cortos sale uno de eso, en parejas, relativamente rápido.","5"
"1576028948-4914","https://losestudiantes.co/","Martha Elizabeth Garavito SuarezAdministración","https://losestudiantes.co/universidad-de-los-andes/administracion/profesores/martha-elizabeth-garavito-suarez","Pros: Es puntual con lo que exige pero si vas a clase y cumples con los criterios es justa con las notas. Le da prioridad a las normas de juego que plantea y las hace respetar.","4"
"1576028807-4162","https://losestudiantes.co/","Dario Alejandro Fuentes FriasAdministración","https://losestudiantes.co/universidad-de-los-andes/administracion/profesores/dario-alejandro-fuentes-frias","Darío es un buen profesor en general. Su clase, al igual que cualquier seccion de Contabilidad, es de aprender por su cuenta. No es dificil si se leen todas las notas de clase y se sabe preguntar. Darío se pierde algunas veces con ciertos temas, y las notas se contradicen con lo que dice en clase. No obstante, es una materia donde se aprende bastante (Repito, por cuenta propia). Ahora, entre las otras secciones, Darío se lleva el premio.Pros: Parciales fáciles
actividades dinamicas en claseCons: Hay que aprender solo
Hay que entregar las tareas a mano (cuando se podrían enviar en excel)","3.7"
"1576028824-4299","https://losestudiantes.co/","Carlos Davila Ladron De GuevaraAdministración","https://losestudiantes.co/universidad-de-los-andes/administracion/profesores/carlos-davila-ladron-de-guevara","Es muy mal profesor con una metodología totalmente escuelera. Puede tener mucho conocimiento y ser profesor emerito pero no sabe explicar nada bien y basa toda la materia en sus libros. Uno piensa que va a aprender mucho en la clase pero lo que termina aprendiendo es muy muy poco. Cons: Los parciales son dificiles y no se aprende nada.","1"
"1576028824-4318","https://losestudiantes.co/","Carlos Davila Ladron De GuevaraAdministración","https://losestudiantes.co/universidad-de-los-andes/administracion/profesores/carlos-davila-ladron-de-guevara","Es un profesor apasionado y sabe mucho, pero es muy escuelero y los parciales son jodidos. Las clases son muy aburridas. Se pasa pero hay que meterle y definitivamente no es una materia que se va a dejar tan alta.Pros: Sabe mucho, es un profesor emérito de la U. Deja sacar lecturas en todos los exámenes.Cons: Muy aburrido. Los parciales son duros. Mucha tarea. Exámenes sorpresa (si no tienes la lectura impresa lo pierdes seguro). Preguntas absurdas en sus exámenes.","3"
"1576028902-4675","https://losestudiantes.co/","Rafael De Jesus Bautista MenaAdministración","https://losestudiantes.co/universidad-de-los-andes/administracion/profesores/rafael-de-jesus-bautista-mena","No tan buen profesor pero da muchas opciones para dejar la materia alta. Hay que estudiar por su cuneta si se quiere aprender de verdad. Pros: FácilCons: No enseña tanto","3"
"1576029051-5326","https://losestudiantes.co/","Emilio Cardona MagneAdministración","https://losestudiantes.co/universidad-de-los-andes/administracion/profesores/emilio-cardona-magne","Pros: Sabe mucho y uno aprende como se puede aplicar todo lo visto en clase en la práctica. Ayuda con bonos cuando a todos les va muy mal en el parcial. Cons: Los parciales y los quizes pueden llegar a ser muy difíciles","4"
"1576028807-4184","https://losestudiantes.co/","Dario Alejandro Fuentes FriasAdministración","https://losestudiantes.co/universidad-de-los-andes/administracion/profesores/dario-alejandro-fuentes-frias","Dario explica solo lo estrictamente necesario y de resto sus clases son hacer talleres. No se aprende mucho y el no es precisamente buena gente.","2"
"1576028941-4860","https://losestudiantes.co/","Lina Maria Castano MesaAdministración","https://losestudiantes.co/universidad-de-los-andes/administracion/profesores/lina-maria-castano-mesa","Una de las mejores profesoras con las que he tenido clase. Comparte mucho sus experiencias, es muy simpática y comprensiva, muy pila y le importa que uno aprenda para que el país pueda mejorar. Se disfruta mucho la clase, y a pesar de que suena aburrida, Lina y el monitor la hacen interesante. Los talleres son en grupo y son fáciles. Hace quices que pueden tener preguntas puntuales pero es para que uno lea en serio, y que ella pueda dar la clase basado en eso. Si no hacen resumenes de lecturas, es bueno tratar de tomar nota de las presentaciones que pone, porque tienen toda la información. Aunque este semestre subió casi todas las presentaciones a sicua.Pros: -Talleres fáciles
-La clase es chévere
-Las preguntas abiertas en los parciales es argumentar basado en ideas de lecturas, no es difícilCons: -Preguntas puntuales en opción múltiple en parciales","5"
"1576029053-5354","https://losestudiantes.co/","Adriana Fernan Triana QuijanoAdministración","https://losestudiantes.co/universidad-de-los-andes/administracion/profesores/adriana-fernan-triana-quijano","Muy desorganizada, aunque al final calificó las actividades que pidió y no fue grave.","3"
"1576028995-5073","https://losestudiantes.co/","Nubia VelascoAdministración","https://losestudiantes.co/universidad-de-los-andes/administracion/profesores/nubia-velasco","Nubia es una excelente profesora. Domina muy bien cada uno de los temas que enseña y transmite su conocimiento de una muy buena manera. Siempre dispuesta a ayudar y responder dudas. Es estricta con los estudiantes, pero muy justa con lo que evalúa y lo que exige.Pros: Muy buen conocimiento de los temas y buen método de enseñanza.Cons: Algo estricta en ocasiones.","5"
"1576029012-5169","https://losestudiantes.co/","Diego Valderrama RojasAdministración","https://losestudiantes.co/universidad-de-los-andes/administracion/profesores/diego-valderrama-rojas","Diego es muy querido y sabe mucho de los temas que se cubren en clase, el único problema es que la manera en que dicta la clase es bastante tediosa (y el hecho que fuera alas 6:30 am no ayudaba). Sus presentaciones tienen muchísimo texto pero lo que sale en el parcial está resaltado entonces no es tan difícil estudiar. La clase en general es fácil y los temas son interesantes, solo que es muy aburrida.Pros: Fácil de dejar alta
Diego sabe mucho del tema
Se discuten temas relevantes para la actualidadCons: Clases aburridas","3.5"
"1576028849-4401","https://losestudiantes.co/","Luz Elena OrozcoAdministración","https://losestudiantes.co/universidad-de-los-andes/administracion/profesores/luz-elena-orozco","Luz es querida y trata de que la gente aprenda pero realmente no sabe explicar: va muy rápido o explica algo y luego decía que estaba mal y que nos olvidaramos de eso, lo que era muy confuso. Los archivos de ejercicios que manda son muy desordenados, al igual que su forma de explicar, por lo que era difícil de entender. Creo que hacía que la materi...
Leer más...Pros: es querida
da posibilidad de bonosCons: es desorganizada
no explica bien
los ejercicios de los bonos son difíciles, o solo las personas que le han entendido desde el principio pueden hacerlos","2.5"
"1576028933-4804","https://losestudiantes.co/","Eduardo Wills HerreraAdministración","https://losestudiantes.co/universidad-de-los-andes/administracion/profesores/eduardo-wills-herrera","Eduardo es un excelente profesor y un amor de persona. Utiliza metodologías interesantes para la materia y para que uno entienda como funcionan las organizaciones en la vida real, no sólo teóricamente. Su voz es un poco monótona por lo que hace que la gente diga que es aburrido, pero los temas son muy interesantes y sabe explicar bien. Muchas traba...
Leer más...Pros:  Explica bien 
Si uno entrega todo es fácil dejarla en buen promedio  Buena metodología de claseCons: Su letra no se entiende y las presentaciones de power point no son muy buenas
Muy relajado","5"
"1576029043-5302","https://losestudiantes.co/","Marcus ThiellAdministración","https://losestudiantes.co/universidad-de-los-andes/administracion/profesores/marcus-thiell","es el mejor profesor que dicta esta clase. hace que todos los temas sean muy cheveres y es muy justo con sus parciales, además tiene un amor por Colombia que le brota por las venas y eso hace que uno lo quiera aun más.Pros: es muy buen profesor y no es difícil, se aprende muchoCons: puede ser muy estricto","5"
