web-scraper-order,web-scraper-start-url,profesoresurl,profesoresurl-href,review,nota
"1576028933-4808","https://losestudiantes.co/","Eduardo Wills HerreraAdministración","https://losestudiantes.co/universidad-de-los-andes/administracion/profesores/eduardo-wills-herrera","Pros: Se preocupa por los estudiantes y no sobrecargarlos
Demuestra interés y conocimiento
Es amable y resuelve las dudas de los estudiantesCons: A veces es muy relajado y la gente se toma la clase a broma","4.5"
"1576028832-4335","https://losestudiantes.co/","Laura MilanesAdministración","https://losestudiantes.co/universidad-de-los-andes/administracion/profesores/laura-milanes","Laura es amable y sabe del tema, sin embargo hace muy monótona la clase y tiende a calificar duro.","3.2"
"1576029019-5178","https://losestudiantes.co/","Andres Link OspinaAdministración","https://losestudiantes.co/universidad-de-los-andes/administracion/profesores/andres-link-ospina","Es un buen profesor. A veces puede ser distraído y eso hace por ratos aburrida la clase pues se extiende mucho en temas innecesarios","4.5"
"1576028853-4415","https://losestudiantes.co/","Jose Camilo Davila Ladron de GuevaraAdministración","https://losestudiantes.co/universidad-de-los-andes/administracion/profesores/jose-camilo-davila-ladron-de-guevara","El profesor es bueno, pero la clase es bien aburrida y se pasa muuuuuy lento","3.7"
"1576028880-4556","https://losestudiantes.co/","Luis Fernando Molina LondonoAdministración","https://losestudiantes.co/universidad-de-los-andes/administracion/profesores/luis-fernando-molina-londono","Sabe mucho del tema, su clase es muy entretenida. No me gustó el sistema de evaluación de la la clase.  No por el hecho de que sea tipo E, sino que no se refleja en las notas el esfuerzo del estudiante. NOTA: NO SE PUEDE SACAR CELULARES.","4"
"1576028877-4545","https://losestudiantes.co/","Andres Mauricio Novella PinzonAdministración","https://losestudiantes.co/universidad-de-los-andes/administracion/profesores/andres-mauricio-novella-pinzon","La clase me parece chevere, siento que en un punto da para mucho más pues al final del semestre la mayoria de las clases son de ver propagandas en youtube y aunque las usa con una razon no se interioriza mucho. Sin embargo Andres sabe mucho del tema y es buen profesor pues su experiencia la comparte con regularidad.Pros: Hay salidas empresariales (Google y IBM)
Es chevere y no es muy dificil dejarla altaCons: Aveces puede ser aburrida","3.9"
"1576028997-5101","https://losestudiantes.co/","Martha Constanza Caceres PorrasAdministración","https://losestudiantes.co/universidad-de-los-andes/administracion/profesores/martha-constanza-caceres-porras","Es una excelente profesora. Toca trabajar en la materia pero igual se aprende demasiado, no es difícil","4.1"
"1576029000-5110","https://losestudiantes.co/","Carlos Felipe Colmenares MisasAdministración","https://losestudiantes.co/universidad-de-los-andes/administracion/profesores/carlos-felipe-colmenares-misas","Realmente la clase da para más pero la manera en que Carlos diseña las actividades deja mucho que desear. Cuando yo la vi se hacían actividades como obras de teatro y coreografía de bailes que hubiera podido ser remplazadas por actividades más relacionado a las empresas y la administración en general. Pros: Sabe del tema de emprendimientoCons: Las actividades que se realizan parecen cosas del colegio","2.1"
"1576029048-5321","https://losestudiantes.co/","Manuel Rodriguez BecerraAdministración","https://losestudiantes.co/universidad-de-los-andes/administracion/profesores/manuel-rodriguez-becerra","Es una clase medio aburrida. Después de ver los documentales, que son casi todos interesantes, el profesor habla hast el final de la clase (y un poco más). Las lecturas son fáciles de entender y hacen comprobaciones de lectura cada semana. También se deben hacer mínimo 7 ensayos de los 14 documentales que se ven y el final es hacer lo mismo pero en clase (es MUY largo).Pros: Con los documentales se toma consciencia de muchos aspectos de la vida cotidiana y el método de calificación de quitar las peores dos notas de las comprobaciones ayuda.Cons: En las comprobaciones a veces preguntan cosas muy puntuales. El man sólo habla de sus libros, su  twitter y de los viajes que tuvo cuando fue ministro. Habla muuuucho (como 1 hora y media sin parar) y no toma en cuenta lo que aportan los demás estudiantes.","2"
"1576028995-5083","https://losestudiantes.co/","Nubia VelascoAdministración","https://losestudiantes.co/universidad-de-los-andes/administracion/profesores/nubia-velasco","Nubia es amable, explica bien y trata de hacer la clase entretenida. Sin embargo, se ven muchos temas en muy poco tiempo, lo cual hace que las clases se vuelvan muy densas y se vaya demasiado rápido. Los parciales no son tan complicados (consiga los del semestre pasado y le puede ir muy bien) y la clase en general no quita mucho tiempo. Nubia suele discutir mucho sobre política y la situación actual del país en clase para que lo tenga en cuenta si es algo que lo puede incomodar.Pros: Explica bien
Parciales coherentes con lo visto en claseCons: Se demora muchísimo devolviendo los parciales (de hecho el segundo nunca lo devolvió)
Clases muy densas y monótonas","3.5"
"1576028863-4491","https://losestudiantes.co/","Julia Helena Diaz RamirezAdministración","https://losestudiantes.co/universidad-de-los-andes/administracion/profesores/julia-helena-diaz-ramirez","Julia es una muy buena profesora y buena persona. La clase puede volverse un poco monótona y muchas veces era aburrida por los temas y por la hora. No es fácil mantener la atención al hablar sobre los distintos autores en clase de 6:30. Sin embargo, la clase es sencilla. Hay muchas actividades en grupo y en clase que representan el 40% de la nota del curso por lo que es importante asistir. Es fácil dejar la nota de la clase alta sin necesidad de leer.Pros: Actividades en grupo y socialización de las lecturas.
Cons: Monótona","4"
"1576028936-4829","https://losestudiantes.co/","Rodrigo Taborda RiosAdministración","https://losestudiantes.co/universidad-de-los-andes/administracion/profesores/rodrigo-taborda-rios","Rodrigo es buen profesor, siempre está dispuesto a resolver dudas dentro y fuera de clase. La clase se puede volver monótona a veces y los talleres son largos pero ayuda hacerlos a conciencia para los quices y el final.","4"
"1576028933-4814","https://losestudiantes.co/","Eduardo Wills HerreraAdministración","https://losestudiantes.co/universidad-de-los-andes/administracion/profesores/eduardo-wills-herrera","Eduardo tiene conocimientos muy amplios de la clase, trata de hacer una clase teorica y otra de trabajo en la semana. Usa muchos simuladores de Harvard por lo cual es un excelente material para aprender.Pros: -Sabe mucho
-Algunos trabajos son interesantesCons: -De vez en cuando hace comprobaciones de lectura exageradamente dificiles","4.1"
"1576028946-4881","https://losestudiantes.co/","Sebastian Leon SchorchAdministración","https://losestudiantes.co/universidad-de-los-andes/administracion/profesores/sebastian-leon-schorch","Sebastian es muy querido y se nota su interés por transmitir los contenidos. Lo único es que no se si pasaba solo en mi sección pero la clase no es dinámica. Es decir, el como que hace preguntas y eso pero no muchos participan entonces las clases se tornan super aburridas. 

Me parece que puede mejorar en las retroalimentaciones puesto que en los group assignments no queda muy claro el porqué de la nota. Pros: Si lees el libro te va bien en los parciales Cons: falta dinamismo","4"
"1576028875-4542","https://losestudiantes.co/","Xavier Hernando Duran AmorochoAdministración","https://losestudiantes.co/universidad-de-los-andes/administracion/profesores/xavier-hernando-duran-amorocho","Es muy querido y explica los temas con mucha claridad. Sin embargo, la metodología no me gustó en lo más mínimo porque las clases se volvían tediosas y muy aburridas. Ahora bien, Xavier expresó el deseo de cambiarla para los próximos semestres para que las clases se vuelvan más interesantes. Toca leer sí o sí porque pregunta a dedo y participación es el 15% de la nota. Las demás actividades no son nada del otro mundo pero si quitan bastante tiempo, sobre todo los ejercicios que se hacen empezando semestre. Comparado con lo que dicen de los otros profesores de historia, Xavier definitivamente parece ser el mejor. Pros: Amable
Explica bienCons: Clases fueron muy tediosas y aburridas
Algunas lecturas fueron muy largas y no eran interesantes","4.5"
"1576028902-4679","https://losestudiantes.co/","Rafael De Jesus Bautista MenaAdministración","https://losestudiantes.co/universidad-de-los-andes/administracion/profesores/rafael-de-jesus-bautista-mena","Es un muy mal profesor. Pareciera que le diera pereza dar clase y se nota mucho que lo hace por compromiso y salir del paso.Pros: Es muy fácil de pasar porque solo mide conocimiento en selección múltiple y deja utilizar todos los recursosCons: No se aprende nada. No se engancha con la clase. Es muy aburrido y es muy irrespetuoso con los estudiantes.","1.5"
"1576028967-5019","https://losestudiantes.co/","Ximena Rueda FajardoAdministración","https://losestudiantes.co/universidad-de-los-andes/administracion/profesores/ximena-rueda-fajardo","Es muy querida y aunque puede ser exigente es muy comprensiva cuando hablas con ella, además sabe mucho del tema y explica bien. La clase puede ser aburrida pero no creo que sea culpa de la profesora, sino de la temática Pros: Muy querida
Sabe mucho del tema
Habla bien inglés Cons: Un poco exigente","4.5"
"1576028924-4770","https://losestudiantes.co/","Marco Antonio Azuero IsazaAdministración","https://losestudiantes.co/universidad-de-los-andes/administracion/profesores/marco-antonio-azuero-isaza","Pros: Es un excelente profesor y la clase es realmente interesante. Sus actividades son acordes con lo que enseña en clase.Cons: En algunas ocasiones la clase se puede volver lenta","4.8"
"1576028804-4157","https://losestudiantes.co/","Javier Yañez ArenasAdministración","https://losestudiantes.co/universidad-de-los-andes/administracion/profesores/javier-ya%C3%B1ez-arenas","Un profesor con mucho para contar pero las clases se pueden tornar aburridas rápidamente. Hay que hacer escritos para cada clase y participar activamente en las discusiones.","3"
"1576028895-4611","https://losestudiantes.co/","Andres Guillermo Urbina FlorezAdministración","https://losestudiantes.co/universidad-de-los-andes/administracion/profesores/andres-guillermo-urbina-florez","Buen profesor, profesional y amable. Su clase (a pesar de ser de 6:30am) nunca fue aburrida y logra que todos estemos atentos. Si se presta buena atención la clase es fácil. Recomendaría nunca faltar a una clase porque en 1 sola se da mucho contenido.Pros: Amable.
Responde a todas las dudas.Cons: Para ser de 1 solo crédito tiene bastante carga académica","5"
"1576028875-4537","https://losestudiantes.co/","Xavier Hernando Duran AmorochoAdministración","https://losestudiantes.co/universidad-de-los-andes/administracion/profesores/xavier-hernando-duran-amorocho","Fue una muy buena clase. Entretenida, algunas trabajos un poco largos y tediosos, pero otros muy interesantes. Recomendado!","4"
"1576029019-5187","https://losestudiantes.co/","Andres Link OspinaAdministración","https://losestudiantes.co/universidad-de-los-andes/administracion/profesores/andres-link-ospina","Es una profesor muy amable y querido, hace chistes de papá de los cuales nadie se ríe excepto él. Sus clases son básicamente las presentaciones Power Point, por lo que puede (para algunos) llegar a ser tediosa. En general, la clase es muy interesante y es una profesor al cual le gusta mucho lo que enseña y se nota que le apasiona. Es un poco desorganizado en el programa y las clases pero no es un punto que no se pueda obviar. Hace quices correspondientes a lo que dice el programa, los trabajos no son difíciles y hace la clase amena.","4.1"
"1576029000-5120","https://losestudiantes.co/","Carlos Felipe Colmenares MisasAdministración","https://losestudiantes.co/universidad-de-los-andes/administracion/profesores/carlos-felipe-colmenares-misas","Aunque la clase esta diseñada para hacer actividades diferentes y entretenidas y en mi opinión esa materia ha mejorado mucho desde que la vi (la vi la primera vez que la abrieron) Carlos no es el mas indicado para incentivarlo a uno. Creo que es mas su forma de ser que la clase en si el problema.","2.9"
"1576029043-5309","https://losestudiantes.co/","Marcus ThiellAdministración","https://losestudiantes.co/universidad-de-los-andes/administracion/profesores/marcus-thiell","Pros: Motiva a los estudiantes a participar en todas las clases y procura hacerlas interesantes","4"
"1576028872-4524","https://losestudiantes.co/","Andres Jose Guerrero AlvaradoAdministración","https://losestudiantes.co/universidad-de-los-andes/administracion/profesores/andres-jose-guerrero-alvarado","Excelente profesor, tiene clara la metodología de sus clases e intenta que sean dinámicas. Los trabajos van acorde a la clase y permite que los estudiantes experimenten y se enfrenten a situaciones que los prepararán para más adelante.Pros: Clases entretenidas, mucho conocimiento, interés por sus estudiantes, está atento en su horario fuera de clases.","5"
"1576028846-4390","https://losestudiantes.co/","Juan Jose Lombana RoaAdministración","https://losestudiantes.co/universidad-de-los-andes/administracion/profesores/juan-jose-lombana-roa","Es un buen profesor. Hay que hacer lecturas dado que en casi todas las clases hace quices pero también hace bonos para ayudar. Los quices valen bastante por lo que si no le gusta leer no será muy agradable. Los parciales son basados únicamente en el libro guía y son en sicua, se hacen desde donde uno quiera y es con libro abierto. Hay talleres largos, en grupo, pero son logrables y se califica bien.","4.8"
"1576028875-4534","https://losestudiantes.co/","Xavier Hernando Duran AmorochoAdministración","https://losestudiantes.co/universidad-de-los-andes/administracion/profesores/xavier-hernando-duran-amorocho","Es una excelente clase y un gran profesor. Xavier explica de una manera agradable, con buenos ejemplos, con historias y comentarios graciosos que hacen que el estudiante no se aburra y que al mismo tiempo aprenda mucho. Sin embargo, exige mucha lectura y al ser un curso tipo E te exige escribir un montón. Pros: Aprendes mucho 
El profesor explica muy bien y está abierto a las preguntas 
Las lecturas en su mayoría son interesantes
Cons: Si la ves como cbu es una materia muy exigente","4.5"
"1576028982-5039","https://losestudiantes.co/","Veneta Stefanova Andonova ZuletaAdministración","https://losestudiantes.co/universidad-de-los-andes/administracion/profesores/veneta-stefanova-andanova-zuleta","Veneta es una gran persona, las primeras clases son muy interesantes sin embargo luego se vuelve muy repetitivo el curso.Pros: Fácil
Las ultimas semanas no hay clase
Cons: Repetitivo","4"
"1576029039-5273","https://losestudiantes.co/","David Schnarch GonzalezAdministración","https://losestudiantes.co/universidad-de-los-andes/administracion/profesores/david-schnarch-gonzalez","En la primera mitad del curso (teoría) las clases son muy llevaderas, no es 100% necesario leer, pero sí tener idea del tema. La clase es dinámica, entretenida y se pasa rápido. Súper recomendado.
La segunda mitad del curso, el proyecto, depende totalmente de la espresa y de lo rápido que encuentren el problema. 

Si no le gusta trabajar en equipo,...
Leer más...","4.5"
"1576028982-5040","https://losestudiantes.co/","Veneta Stefanova Andonova ZuletaAdministración","https://losestudiantes.co/universidad-de-los-andes/administracion/profesores/veneta-stefanova-andanova-zuleta","Veneta es una muy buena profesora. Es exigente con el aprendizaje pero al mismo tiempo se preocupa porque los estudiantes aprendan. Los contenidos de la clase son muy interesantes y ella es una muy buena persona con quien se puede hablar sobre inquietudes de la clase. Promueve la participaciónCons: Es un poco desorganizada con el programa y el orden de las sesiones de clase. Además, si no hay un buen monitor no se pautan instrucciones claras sobre el proyecto final en cuanto a instrucciones y fechas de entrega.","4.6"
"1576028936-4838","https://losestudiantes.co/","Rodrigo Taborda RiosAdministración","https://losestudiantes.co/universidad-de-los-andes/administracion/profesores/rodrigo-taborda-rios","Más que por el profesor, herramientas 1 es una materia con demasiado tema en muy poco tiempo. Entonces Rodrigo va a toda y no explica muy bien. Tampoco une los temas del curso a la administración. Además es super cerrado a preguntas de los estudiantes y para reclamos. Sin embargo, su metodología de talleres del 70% hace que pasar la materia sea ""fácil"" si uno se esfuerza en dejar la nota de talleres alta.  Pros: Gran porcentaje en talleres en casa.
Cons: Es cerrado a preguntas
No explica muy bien","3.5"
"1576028918-4748","https://losestudiantes.co/","German Alfredo Orejarena SerranoAdministración","https://losestudiantes.co/universidad-de-los-andes/administracion/profesores/german-alfredo-orejarena-serrano","Muy buen profesor, hace la clase dinámica y ayuda a que por medio de los talleres (con trabajo de campo) los estudiantes entiendan mejor los conceptosPros: pregunta en los quizzes y parciales los conceptos principales de las lecturas y aprendidos en clase
Presentaciones con diapositivasCons: hace quiz todas las clases, cuenta puntualidad","5"
"1576029006-5131","https://losestudiantes.co/","Ernesto Cuellar UrbanoAdministración","https://losestudiantes.co/universidad-de-los-andes/administracion/profesores/ernesto-cuellar-urbano","Pros: Si hay artas cosas por hacer al semestre pero son muy fáciles y califica hiper suave.
Se aprende mucho.Cons: Es demasiado querido y algunos estudiantes se aprovechan de eso.","5"
"1576028853-4434","https://losestudiantes.co/","Jose Camilo Davila Ladron de GuevaraAdministración","https://losestudiantes.co/universidad-de-los-andes/administracion/profesores/jose-camilo-davila-ladron-de-guevara","El profesor es muy amable y querido, pero puede ser un poco monótona la clase. Se aprende principalmente con las lecturas. El proyecto final ayuda a poner en práctica lo aprendido, y es interesante.","4.5"
"1576028906-4698","https://losestudiantes.co/","Carlos Andres Rodriguez CortesAdministración","https://losestudiantes.co/universidad-de-los-andes/administracion/profesores/carlos-andres-rodriguez-cortes","El peor, es muy mal profesor, no enseña nada, toda la clase la dicta el monitor. Con su metodologia de autoaprendizaje hace que gran parte de las personas pierdan el curso o la retiren. Deja muchas tareas que no se acercan a los parciales largos y difíciles que hace.
NUNCA METAN CON EL, JAMAS","1.6"
"1576029043-5304","https://losestudiantes.co/","Marcus ThiellAdministración","https://losestudiantes.co/universidad-de-los-andes/administracion/profesores/marcus-thiell","Es uno de los mejores profesores que he tenido. Demasiado querido, abierto a ayudar a los estudiantes. El ingles puede ser intimidante al comienzo pero despues es muy claro. La clase es dinámica, interesante y muy aplicada a la vida real.Pros: Cero matematicas
Muy acertada a el contexto actual del mundo
Sabe demasiado
Es comprensivo
No hay asistenciaCons: Los trabajos pueden ser difíciles en cuanto a escritura formal en ingles
Parciales específicos del libro y de cosas de clase
Califica participación","5"
"1576029009-5144","https://losestudiantes.co/","Carlos Andres TrujilloAdministración","https://losestudiantes.co/universidad-de-los-andes/administracion/profesores/carlos-andres-trujillo","La clase es fácil, pero no vale la pena meterla con este profesor. Los talleres no los hacen todos los grupos al tiempo, entonces uno no aprende bien todos los temas del curso. 

No entrega las diapositivas que utiliza en clase y no son fáciles de ver pues les pone un fondo muy oscuro. Además, son súper desordenadas y el no habla acorde a lo que está presentando entonces normalmente uno está muy perdido.
Pros: Fácil
No hace controles de lecturaCons: No entrega diapositivas.
Muy Aburrida
No se aprende nada","2"
"1576028933-4806","https://losestudiantes.co/","Eduardo Wills HerreraAdministración","https://losestudiantes.co/universidad-de-los-andes/administracion/profesores/eduardo-wills-herrera","Es un excelente profesor, se preocupa de que sus estudiantes entiendan las temáticas propuestas para la clase además de que intenta cambiar la visión de todos nosotros para generar un cambio significativo en el paísPros: Es buena gente, siempre dispuesto a dialogarCons: La clase se puede tornar un poco monótona","4.4"
"1576028880-4564","https://losestudiantes.co/","Luis Fernando Molina LondonoAdministración","https://losestudiantes.co/universidad-de-los-andes/administracion/profesores/luis-fernando-molina-londono","Molina es de lejos uno de los mejores profesores que tuve durante la universidad, si tienen la oportunidad metan historia con él, es duro pero no se van a arrepentir.","5"
"1576028884-4579","https://losestudiantes.co/","Catalina Estrada MejiaAdministración","https://losestudiantes.co/universidad-de-los-andes/administracion/profesores/catalina-estrada-mejia","Pros: Gran persona (querida, paciente y carismática).
Super dispuesta a resolver dudas en clase y por fuera. 
Flexible con ciertas fechas de entrega. 
Parciales justos, relacionados al libro y a las presentaciones. 
Ejemplos reales sobre la teoría. Cons: Talleres MUY largos, se pueden volver complicados si trabajas con un grupo con el que no te entiendes. 
Quizzes sorpresa sobre el libro. 
NO vale la pena comprar el libro (35,000 pesos para pocos usos), busquen una copia en internet.","4.8"
"1576028991-5069","https://losestudiantes.co/","Felipe Andres Martinez FallaAdministración","https://losestudiantes.co/universidad-de-los-andes/administracion/profesores/felipe-andres-martinez-falla","Excelente profesor. Pone muchos trabajos fáciles y los parciales son relajados. A el le importa que el estudiante aprenda y no la nota, entonces es muy fácil dejarla alta. Muy recomendado.","5"
"1576029019-5198","https://losestudiantes.co/","Andres Link OspinaAdministración","https://losestudiantes.co/universidad-de-los-andes/administracion/profesores/andres-link-ospina","Andrés es un profesor muy apasionado por los temas que dicta, tiene mucho conocimiento en el tema y en general es una buena persona.Cons: Se nota que tiene más pasión por la investigación que por las clases. En algunos momentos pueden ser aburridas.","4.5"
"1576028866-4494","https://losestudiantes.co/","Gustavo Alfonso Gonzalez CoutureAdministración","https://losestudiantes.co/universidad-de-los-andes/administracion/profesores/gustavo-alfonso-gonzalez-couture","Es una persona que conoce mucho y de la cual se pueden aprender cosas interesantes. Es bastante exigente y sus clases pueden llegar a ser un poco monótonas","3.5"
"1576028895-4616","https://losestudiantes.co/","Andres Guillermo Urbina FlorezAdministración","https://losestudiantes.co/universidad-de-los-andes/administracion/profesores/andres-guillermo-urbina-florez","Andrés es una persona muy querida. Se preocupa porque todos aprendan. Se esfuerza mucho por enseñar cosas prácticas que sí sirven para la vida real y no se enfoca solo en la teoría. Se aprende mucho","4.9"
"1576028817-4277","https://losestudiantes.co/","Oscar Francisco Trujillo ReyesAdministración","https://losestudiantes.co/universidad-de-los-andes/administracion/profesores/oscar-francisco-trujillo-reyes","Oscar es un muy buen profesor. Explica muy bien y los parciales son pasables e inclusive se pueden dejar en 5 si se estudia. Deja bastantes tareas pero en general son cortas. Se puede pasar y dejar alto el final con el (yo lo deje en 42)Pros: A veces se torna un poco aburrido","5"
"1576029012-5153","https://losestudiantes.co/","Diego Valderrama RojasAdministración","https://losestudiantes.co/universidad-de-los-andes/administracion/profesores/diego-valderrama-rojas","Diego es demasiado querido y relajado en su clase. Si bien hay ciertos contenidos del curso más interesantes que otros su dinámica no es la más atractiva para los estudiantes.Pros: Los parciales y trabajos son demasiado fáciles entonces al no ser de que no entreguen van a sacar buena nota 
El es muy abierto si el estudiante tiene preguntas y en su horario de atención es muy dedicadoCons: Las diapositivas son demasiado pesadas (muchisisisima letra)
No te motiva  meterte en la clase 
Llega a ser repetitivo
Poco exigente","1"
"1576028931-4793","https://losestudiantes.co/","Andres Mora ValenciaAdministración","https://losestudiantes.co/universidad-de-los-andes/administracion/profesores/andres-mora-valencia","El método de enseñanza de Andrés no tiene ningún sentido. Hace comprobaciones de lectura y quizzes muy difíciles y en algunos casos sobre temas que Andrés aún no había enseñado.  Sus parciales son totalmente desmedidos con lo que enseña. El promedio de ambos parciales estuvo por debajo de 3. Solo 8 personas pasaron el curso y eso que hizo una especie de curva porque en realidad solo 3 habían logrado pasar.Cons: Evaluaciones desmedidas
Pregunta cosas que aún no enseña","1.5"
