web-scraper-order,web-scraper-start-url,profesoresurl,profesoresurl-href,review,nota
"1576028900-4658","https://losestudiantes.co/","Luis Diaz MatajiraAdministración","https://losestudiantes.co/universidad-de-los-andes/administracion/profesores/luis-diaz-matajira","Luis es un buen profesor. La clase trata temas muy interesantes y él los explica de manera clara y con ejemplos de la vida diaria. Es alguien dispuesto a ayudar a los estudiantes si llegan a tener dificultades.Pros: Conoce muy bien todos los temas que dicta en el curso.

Puede convertirse en un gran apoyo para los estudiantes.Cons: Su conocimiento se puede llegar a desaprovechar por el tamaño de la clase (120 personas), ya que la interacción con él es poca.","4.5"
"1576028986-5062","https://losestudiantes.co/","Angelica Maria Flechas BustosAdministración","https://losestudiantes.co/universidad-de-los-andes/administracion/profesores/angelica-maria-flechas-bustos","Angélica es una excelente profesora. Las clases que dicta siempre son bastante dinámicas y entretenidas. Enseña con mucha pasión y es demasiado querida con las personas. Cons: nada","5"
"1576029006-5136","https://losestudiantes.co/","Ernesto Cuellar UrbanoAdministración","https://losestudiantes.co/universidad-de-los-andes/administracion/profesores/ernesto-cuellar-urbano","Ernesto es un profesor que se interesa por los estudiantes. Si te acercas con dudas el te va a explicar el tema a profundidad buscando que entiendas y se te resuelva las dudas. Hace casos Hardvard y presentaciones de estudiantes (se intercala).","5"
"1576028832-4334","https://losestudiantes.co/","Laura MilanesAdministración","https://losestudiantes.co/universidad-de-los-andes/administracion/profesores/laura-milanes","La profesora es amable, pero sus clases no son las mas entretenidas. Es dificil pasar la materia con una nota muy alta ya que califica duro.Pros: Es amable y te tiene en cuenta si asistes a clase y participasCons: clase aburrida y monotona, muchas actividades en clase, por lo tanto es necesario asistir a clase","3.3"
"1576028954-4928","https://losestudiantes.co/","Alejandro Castillo VallejoAdministración","https://losestudiantes.co/universidad-de-los-andes/administracion/profesores/alejandro-castillo-vallejo","La clase con alejandro es bien distinta. El como que quiere que uno tenga un pensamiento critico y que se nutra un poco con cultura general, lo que me parece chevere. Es una clase facil que enseña disciplina y conciencia y la verdad me gusto por que alejandro echa unos madrazos al mundo que hacen que la clase sea diferente.","4"
"1576028875-4538","https://losestudiantes.co/","Xavier Hernando Duran AmorochoAdministración","https://losestudiantes.co/universidad-de-los-andes/administracion/profesores/xavier-hernando-duran-amorocho","Sabe mucho del tema y la clase maneja un buen nivel de dificultad.","5"
"1576028963-4996","https://losestudiantes.co/","Clemente Forero PinedaAdministración","https://losestudiantes.co/universidad-de-los-andes/administracion/profesores/clemente-forero-pineda","la clase es muy útil y sí se aprende, pero la metodología es muy escuelera, hay que leer detalles innecesarios, la mitad de la veces la clase es muy aburrida, no es claro con las instrucciones, es un viejo que a veces es como prepotente. Pros: se aprende
se conoce gente
se debate muchoCons: escuelero
prepotente
información incompleta
se dedica mucho en los detalles","3.5"
"1576029048-5322","https://losestudiantes.co/","Manuel Rodriguez BecerraAdministración","https://losestudiantes.co/universidad-de-los-andes/administracion/profesores/manuel-rodriguez-becerra","Pros: Saber mucho sobre un tema no es suficiente para ser buen profesor. A pesar de ser experto, no contribuye demasiado al desarrollo de la clase.Cons: No sirve leer o participar, al final el considera irrelevantes los aportes y contradice todo lo que los estudiantes dicen.","2"
"1576029026-5221","https://losestudiantes.co/","Eric QuintaneAdministración","https://losestudiantes.co/universidad-de-los-andes/administracion/profesores/eric-quintane","De los mejores profesores que he tenido, su clase puede ser un poco pesada pero te motiva a aprender. Tiene mucho conocimiento practico acerca de los temas que se ven en clase lo cual lo hace muy didáctico.Pros: A tenido experiencias con los temas que enseña lo cual le da otra perspectiva a cada temaCons: Puede ocupar mucho tiempo la clase","5"
"1576028807-4198","https://losestudiantes.co/","Dario Alejandro Fuentes FriasAdministración","https://losestudiantes.co/universidad-de-los-andes/administracion/profesores/dario-alejandro-fuentes-frias","Darío es un docente muy informado en su materia, sin embargo no tiene tan buena actitud para dar la clase. A pesar de esto, explica muy bien y resuelve todas las dudas que surjan a los estudiantes en el horario de clase o fuera del mismo. Propone un taller de recomendación de inversión, que suena interesante, pero que finalmente no es más que una explicación de un power point que se torna aburrida. Monitores desconectados de la clase y del docente.Pros: Conocimiento claro, explica muy bien, resuelve las dudasCons: Actitud poco agradable, bajo incentivo al goce de la clase, un taller aparentemente empresarial que no sube del nivel de una exposición de colegio.","3.4"
"1576028884-4581","https://losestudiantes.co/","Catalina Estrada MejiaAdministración","https://losestudiantes.co/universidad-de-los-andes/administracion/profesores/catalina-estrada-mejia","Es una excelente profesora. Es muy satisfactorio llegar a una clase y saber que el profesor tiene como principal objetivo que sus estudiantes aprendan y les vaya bien. La clase es relajada, yendo a clase y poniendo atencion no debe haber ningun problema. Muy recomendada.Pros: Muy amable","5"
"1576028863-4478","https://losestudiantes.co/","Julia Helena Diaz RamirezAdministración","https://losestudiantes.co/universidad-de-los-andes/administracion/profesores/julia-helena-diaz-ramirez","La clase es una perdida de tiempo completa y es imposible no ir a esta pues la asistencia es realmente importante para ella. Julia no atrae la atención de los estudiantes en lo mas minino y no  incentiva a que estos se apeguen a la carrera de administración. La clase tiene bastantes lecturas pero no son muy útiles. No obstante, es una clase realmente fácil de dejar alta, los parciales son fáciles, hace unos quices muy básicos de las lecturas y hace talleres y entregas que se sacan adelante con mínimos de conocimiento. Pros: Es buena gente
Notas facilesCons: No capta la atencion
Muchos trabajos
Asistencia requerida","3"
"1576028853-4425","https://losestudiantes.co/","Jose Camilo Davila Ladron de GuevaraAdministración","https://losestudiantes.co/universidad-de-los-andes/administracion/profesores/jose-camilo-davila-ladron-de-guevara","Muy buen profesor, pese a que el contenido de la clase es un poco pesado se aprende bastante y si uno muestra interés se aprende mucho más fácil. Pros: Muy buen maestro
Busca aplicar la teoría a experiencias profesionales a lo largo de su vida.Cons: La clase es muy temprano","4.3"
"1576029006-5135","https://losestudiantes.co/","Ernesto Cuellar UrbanoAdministración","https://losestudiantes.co/universidad-de-los-andes/administracion/profesores/ernesto-cuellar-urbano","El curso con Ernesto es básicamente una clase de presentaciones de los estudiantes y otra de discusión de un caso que se prepara previamente. Los temas que se tratan son muy útiles y de verdad que se aprende mucho por medio de las presentaciones que a uno le toca hacer. Sin embargo, se puede volver monótona la clase por tantas presentaciones.Pros: Califica muy suave
AmableCons: El curso se puede volver monótono","4"
"1576029026-5224","https://losestudiantes.co/","Eric QuintaneAdministración","https://losestudiantes.co/universidad-de-los-andes/administracion/profesores/eric-quintane","Eric es de los mejores profesores que he tenido en la carrera. Su método de enseñar es muy bueno, prepara muy bien cada clase y sabe del tema. Además la clase en sí puede ser aburrida por lo teórica pero el la hace dinámica con ejemplos, ejercicios y juegos. Cada semana hay que entregar un caso en grupo, pero a partir de esos casos uno aprende much...
Leer más...Pros: La clase es dinámica, el se preocupa por los estudiantes y se aprende mucho.Cons: Es muy teórica","5"
"1576028936-4841","https://losestudiantes.co/","Rodrigo Taborda RiosAdministración","https://losestudiantes.co/universidad-de-los-andes/administracion/profesores/rodrigo-taborda-rios","Durante el semestre van a tener momentos en donde se sienten en el limbo, como que si y no a la vez. Este curso implica hacer TODOS los talleres a conciencia porque pude que la parte teórica con las fórmulas no quede clara en clase pero aun así que se puedan analizar los datos con los comandos.
Sin embargo es una clase muy chévere, interesante y extremadamente útil. Rodrigo es un crack con Stata por lo cual deben aprovechar todo lo que él tiene para enseñar, pero también deben poner de su parte. 
Pros: Rodrigo hace la clase dinámica fomentando participación
Da en todo momento aplicaciones prácticas 
Es chistoso pero puede herir susceptibilidades
Super abierto a preguntas pero me parece que es mejor aclararlas en la ofician de él porque en clase por la cantidad de tema de pronto no se puede tomar todo el tiempo para solucionarlas Cons: La explicación teórica cada clase es el momento en donde la mayoría si no son todos los estudiantes nos perdemos, pero luego con los ejemplos nos reconectamos","4"
"1576028931-4787","https://losestudiantes.co/","Andres Mora ValenciaAdministración","https://losestudiantes.co/universidad-de-los-andes/administracion/profesores/andres-mora-valencia","Excelente profesor, es practico y hace que uno se interese por la clase. Es muy buena persona y desarrolla la mayoria de ejemplos en casos de la vida real. Su metodologia no es facíl, porque uno termina perdiendo la mayoria de quices y comprobaciones de lectura, pero pues eso lo fuerza a uno a estudiar y a estar preparado para los parciales. Pros: Practico 
Tiene pedagogia 
Buena persona 
Apasionado por la materia 
Gran manejo del tema 
Parciales acordes a lo visto Cons: Uno sufre la mayor parte del semestre 
Quices difíciles","5"
"1576028812-4240","https://losestudiantes.co/","Rosa Isabel Gonzalez MuñozAdministración","https://losestudiantes.co/universidad-de-los-andes/administracion/profesores/rosa-isabel-gonzalez-mu%C3%B1oz","- Muy buena profesora. Explica Muy bien.
- NO es la sección fácil
- Es la sección que los deja preparados para no perder el final unificado.

Para tener notas geniales:
1. Parciales y final: Aunque no parezcan, son de comprensión lectora y lógica. Comprender el tema y su lógica. Lo lógica es biiiiieeen importante.    La mayoría de personas se dejan...
Leer más...","4.8"
"1576028817-4287","https://losestudiantes.co/","Oscar Francisco Trujillo ReyesAdministración","https://losestudiantes.co/universidad-de-los-andes/administracion/profesores/oscar-francisco-trujillo-reyes","Oscar es un profesor que enseña lo básico, hace muchos talleres de cada tema y no se complica con la teoría. Considero que no es la mejor opción para ver planeación, porque es un curso que requiere de buenas bases desde el inicio y Oscar no exponía detalladamente, sino que llenaba Excel. A mi parecer, los parciales no tenían mucha relación con los talleres y requerían de mucha lógica, sumada a entender cada uno de los conceptos. Considero que no le apasiona dar clase y no es el profesor adecuado para sacarle todo el provecho a los temas, porque es un curso muy útil. Pros: Es relajado
Deja sacar hoja de fórmulas en los parciales
Talleres logrables
Pone pre-parciales para familiarizarse con las preguntas Cons: El proyecto final
Su tono de voz no ayuda 
Se nota que no le gusta dar clase
No explica bien
No escogió bien a los monitores","3"
"1576028931-4782","https://losestudiantes.co/","Andres Mora ValenciaAdministración","https://losestudiantes.co/universidad-de-los-andes/administracion/profesores/andres-mora-valencia","La clase es dura pero se aprende mucho. Es uno de los mejores profesores que he tenido. Cons: Se va a sacar varios ceros en los quices, relajese","4.3"
"1576028895-4619","https://losestudiantes.co/","Andres Guillermo Urbina FlorezAdministración","https://losestudiantes.co/universidad-de-los-andes/administracion/profesores/andres-guillermo-urbina-florez","Excelente profesor. Muy amable y dispuesto a ayudar. Es una clase que enseña demasiado como para que sea de un solo crédito. -Pros: - Muy fácil dejarla alta
- La monitora es una paisa divina que ayuda demasiado en clase y hace monitorías antes de los parciales.","5"
"1576028812-4225","https://losestudiantes.co/","Rosa Isabel Gonzalez MuñozAdministración","https://losestudiantes.co/universidad-de-los-andes/administracion/profesores/rosa-isabel-gonzalez-mu%C3%B1oz","Super recomendada. Es una profesora que sabe explicar muy bien y cuando sacas citas con ella para tocar temas que se dificultan, es super paciente y te explica de la mejor manera posible (siempre y cuando tengas una buena actitud).","4.6"
"1576028941-4866","https://losestudiantes.co/","Lina Maria Castano MesaAdministración","https://losestudiantes.co/universidad-de-los-andes/administracion/profesores/lina-maria-castano-mesa","Pros: Explica muy bien y las presentaciones tienen toda la información necesaria. Deja talleres relativamente fáciles.Cons: Los parciales son de preguntas muy puntuales y no monta las presentaciones a Sicua.","5"
"1576028821-4297","https://losestudiantes.co/","Maria Alejandra Velez LesmesAdministración","https://losestudiantes.co/universidad-de-los-andes/administracion/profesores/maria-alejandra-velez-lesmes","Excelente profesora, apasionada con los temas y experta en los mismos. Puede ser dura en la hora de calificar y algunas personas consideran que trata de imponer su punto de vista pero es solo porque siempre esta dispuesta a debatir, si a usted le gusta debatir temas de actualidad, sociedad, modelos económicos, política, o le gustaría aprender bastante sobre esos temas Maria Alejandra es la mejor opción para esta clase.Pros: Conocedora del tema.
Explica con claridad.","5"
"1576028856-4440","https://losestudiantes.co/","Jorge Ricardo Barriga PalacioAdministración","https://losestudiantes.co/universidad-de-los-andes/administracion/profesores/jorge-ricardo-barriga-palacio","Es el curso más sobrevalorado que he visto, todo el mundo aclama su clase, pero honestamente, siento que no es nada del otro mundo. Reconozco que después de ver con él, uno ya no le tiene miedo a nadie ni a nada en la universidad. Su propuesta de valor es una estructura mental pero que, si usted estudia otra carrera aparte de administración o diseño, tal vez ya tenga esta estructura mental, entonces, ya no necesita ver con él. Desde mi perspectiva es más lo que se sufre que lo que se aprende. Además, sus clases de contenido son PESIMAS, llega a repetir lo que dice el libro o la lectura de ese día. Por otra parte, los casos de estudio y esas clases son la mejor parte del curso, es decir, de verdad se aprende por medio de los casos y en mi experiencia son los mejores casos y clases de su materia (aunque tenga unos cálculos muy regulares). Pros: -	Casos útiles
-	Lecturas interesantes

Cons: - Es muy hostil, su forma de hacerle saber a alguien que está mal es muy grosera.
- Clases de contenido inútiles
Sistema de calificación muy subjetivo en cuanto a la participación (no me fue mal)
- Hace recomendaciones del proyecto que no son acertadas e incluso uno se cuestiona sobre sus capacidades para asesorar la consultoría.","2.5"
"1576028880-4567","https://losestudiantes.co/","Luis Fernando Molina LondonoAdministración","https://losestudiantes.co/universidad-de-los-andes/administracion/profesores/luis-fernando-molina-londono","Las clases con él son muy buenas porque tiene un conocimiento enorme sobre casi cualquier tema referente a la historia empresarial del país y cuenta cada historia de una forma que lo conecta a uno de una forma impresionante. En cuanto al diseño de la clase, creo que está muy mal estructurada la forma en que evalúan porque es super escuelera y exige...
Leer más...Pros: El enorme conocimiento de los temas y los casos reales que expone en clase, enriquecen mucho la clase.Cons: Muy escuelera y exigente sin lograr el objetivo que realmente se aprenda lo importante de la clase.","4.3"
"1576028837-4368","https://losestudiantes.co/","Mariano Alberto Lopez FajardoAdministración","https://losestudiantes.co/universidad-de-los-andes/administracion/profesores/mariano-alberto-lopez-fajardo","Es una excelente persona y un magnífico profesor. Fui testigo de cómo ayudó a determinadas personas que iban mal en la clase por medio de nuevas opciones de financiamiento u otras opciones para que la empresa pudiera salir adelante(hablo de Juego Gerencial). Siempre está dispuesto a ayudar a los estudiantes por fuera del horario de clase, e incluso discutir temas aparte de la clase. Es un profesor que lo puede retar a uno, pero que vale la pena incluso si uno recibe una nota menor a la esperada","4.8"
"1576028915-4738","https://losestudiantes.co/","Gabriel Perez CifuentesAdministración","https://losestudiantes.co/universidad-de-los-andes/administracion/profesores/gabriel-perez-cifuentes","excelente profesorPros: las clases se basan en su experiencia, muy tierno y preocupado porque pasemos y entendamos.","5"
"1576028902-4676","https://losestudiantes.co/","Rafael De Jesus Bautista MenaAdministración","https://losestudiantes.co/universidad-de-los-andes/administracion/profesores/rafael-de-jesus-bautista-mena","Es una gran persona pero como profesor deja muchísimo que desear. No aprendí mucho con el pero dejé su materia en 5.Pros: Es muy facil pasar con elCons: No se aprende nada","1"
"1576028997-5106","https://losestudiantes.co/","Martha Constanza Caceres PorrasAdministración","https://losestudiantes.co/universidad-de-los-andes/administracion/profesores/martha-constanza-caceres-porras","Yo ya sabía de este tema entonces no aprendí mucho y se me hizo que ella enseña muy lento, lo que me desesperó y me hizo perder motivación. Sin embargo es una persona agradable.","3.5"
"1576028936-4831","https://losestudiantes.co/","Rodrigo Taborda RiosAdministración","https://losestudiantes.co/universidad-de-los-andes/administracion/profesores/rodrigo-taborda-rios","Me pareció un muy buen profesor, en general las clases eran entretenidas y la materia es fácil. A veces puede llegar a ser un poco desorganizado pero no es nada grave.","4"
"1576028837-4348","https://losestudiantes.co/","Mariano Alberto Lopez FajardoAdministración","https://losestudiantes.co/universidad-de-los-andes/administracion/profesores/mariano-alberto-lopez-fajardo","Muy mal profesor! No se lo recomiendo a nadie!!!Cons: todo","1.5"
"1576029046-5316","https://losestudiantes.co/","Jairo Rafael Montoya TorresAdministración","https://losestudiantes.co/universidad-de-los-andes/administracion/profesores/jairo-rafael-montoya-torres","Profesor muy respetuoso y dedicado a los estudiantes. Muy buena persona y dispuesto a solucionar cualquier duda. Los exámenes fueron fáciles y ayuda en ellos. Las explicaciones teóricas fueron bastante claras y respaldadas por lo práctico. Muy recomendado.","4.5"
"1576029024-5208","https://losestudiantes.co/","Carlos Eduardo Hernandez CastilloAdministración","https://losestudiantes.co/universidad-de-los-andes/administracion/profesores/carlos-eduardo-hernandez-castillo","Sabe mucho del tema, pero es un pésimo profesor dictando un curso muy mal planeado.Pros: Maneja muy bien los temas que dicta, es imposible corcharlo. Es lo ÚNICO positivo que puedo decir sobre el.Cons: Primero, la puntualidad. NO HUBO NI UNA SOLA CLASE en todo el semestre en la que haya llegado de manera puntual. Se pone de acuerdo con los monitores para hacer quiz cuando sabe que va a llegar tarde. Segundo, que deje de ser tan mamón. Si, tan mamón. Es tedioso ir a su clase. Bajo reglas y normas como ""no sacar el celular o te ponen 0 en el mejor quiz"" logra a medias captar la atención de los estudiantes. No se puede sacar computador ni celular para tomar notas (donde yo acostumbro a hacerlo). De la misma manera, existe una obsesión a la hora de buscar un error en los trabajos y tareas de los estudiantes. El más mínimo error es castigado y penalizado, y esto se ve reflejado en el promedio de las notas finales de este curso. Tercero, la cantidad de quices. ¿Es necesario hacer 15-20 quices en todo el semestre? incluso 2 o 3 por clase? No es necesario. Simplemente es una manera en la que Carlos obliga a los estudiantes a quedarse en su aburrida y tediosa clase y que hagan las lecturas. Un pésimo profesor. Honestamente, el peor que he tenido en mis 4 semestres de universidad.","2"
"1576028946-4884","https://losestudiantes.co/","Sebastian Leon SchorchAdministración","https://losestudiantes.co/universidad-de-los-andes/administracion/profesores/sebastian-leon-schorch","Es un profesor que sabe muchísimo del tema y en mi opinión es el más preparado de todos los profesores que dan esta clase. Es una pésima idea meter la clase si no se tiene un buen nivel de inglés. Pros: Muy querido y dispuesto a resolver dudas
talleres aterrizados (de la vida real)
Califica Cons: Hace quiz sorpresa de las lecturas 
toma asistencia siempre
es muy estricto con el uso de celulares","4.5"
"1576029000-5124","https://losestudiantes.co/","Carlos Felipe Colmenares MisasAdministración","https://losestudiantes.co/universidad-de-los-andes/administracion/profesores/carlos-felipe-colmenares-misas","Las actividades que deja consumen mucho tiempo contando que la clase solo tiene 1 crédito. La clase podría ser un poco más relacionada a la administración de empresas pero en realidad lo que hicimos en el semestre fue colorear mandalas, hacer aviones de papel, jugar con Legos, cocinar, bailar y hacer obras de teatro (me sentía en una clase de pre-escolar). Felipe es buena persona y trata de que la clase sea divertida y sabe mucho de los temas, pero en realidad podría aterrizar un poco más la clase al tema de emprendimiento.","3.5"
"1576028837-4357","https://losestudiantes.co/","Mariano Alberto Lopez FajardoAdministración","https://losestudiantes.co/universidad-de-los-andes/administracion/profesores/mariano-alberto-lopez-fajardo","Excelente profesor. Sabe mucho y ayuda a los estudiantes en lo que necesitan. No es del todo fácil pero se aprende.","4.8"
"1576028984-5047","https://losestudiantes.co/","Rodrigo BrittoAdministración","https://losestudiantes.co/universidad-de-los-andes/administracion/profesores/rodrigo-britto","En sus clases en general se preocupa por que los estudiantes realmente aprendan los conceptos. No tiene proble en explicar varias veces o sacar tiempo aparte para solucionar dudas adicionales. Se nota que le gusta los temas que explica y que disfruta compartiendo conocimiento. Sus talleres y parciales suelen ser un poco largos pero el entiende esto y procura colaborar.","5"
"1576029043-5306","https://losestudiantes.co/","Marcus ThiellAdministración","https://losestudiantes.co/universidad-de-los-andes/administracion/profesores/marcus-thiell","Es el mejor profesor de verdad ensena con pasion y con anecdotas que le han pasado juzgandolas desde una perspectiva profesional, ademas, los temas son super interesantes si lees el libro, asistes a clase y participas es muy facil dejar la materia en 5. El libro que se usa en clase es excelente.","4.9"
"1576028997-5096","https://losestudiantes.co/","Martha Constanza Caceres PorrasAdministración","https://losestudiantes.co/universidad-de-los-andes/administracion/profesores/martha-constanza-caceres-porras","Es muy buena profesora, esta dispuesta a ayudar con tareas y trabajos en su oficinaCons: sus parciales son muy largos
sus quices son teóricos (debe ver el material que ella sube)","4"
"1576028948-4921","https://losestudiantes.co/","Martha Elizabeth Garavito SuarezAdministración","https://losestudiantes.co/universidad-de-los-andes/administracion/profesores/martha-elizabeth-garavito-suarez","Martha es una profesora realmente dedicada para esta clase. Si bien es bastante exigente con el tema de las lecturas, llegar preparado a clase pues si ve que los estudiantes no leen hace quiz, esto es lo que deben esperar pues el curso es de Historia, por lo tanto se debe leer y entender cada eje en el que se basa la clase. Personalmente me encanto la clase no solo porque el tema es muy interesante sino también por el hecho de que las síntesis que se realizan durante el semestre son muy útiles. El problema no es que ella sea escuelera, si los estudiantes no hacen nada en la clase pues les parecerá fastidioso. Ella en verdad es muy buena Pros: Prepara de una manera verdaderamente organizadas las clases
Su dinámica es de una charla continua con el estudiante lo que lo hace interesante 
Complementa a la perfección las lecturas pues no repite lo mismo sino que te da información y datos adicionales 
Su calificación es acorde a lo planteado desde el primer día","4.5"
