web-scraper-order,web-scraper-start-url,profesoresurl,profesoresurl-href,review,nota
"1576042725-18295","https://losestudiantes.co/","Martin PackerPsicología","https://losestudiantes.co/universidad-de-los-andes/psicologia/profesores/martin-packer","Es el peor profesor que he tenido en toda la universidad. La clase a parte de ser aburrida, no se aprende absolutamente nada, se enreda explicando, se inventa porcentajes de las notas y hasta las notas de algunos. Es irrespetuoso y grosero. No aprendí nada y no entiendo como puede pasar en alto su irrespeto con los estudiantes. Pros: NadaCons: Irrespetuoso, grosero, no es claro con las notas, califica injustamente, no se le entiende nada, aburrido.","1"
"1576042849-18587","https://losestudiantes.co/","Jane Naismith IonaPsicología","https://losestudiantes.co/universidad-de-los-andes/psicologia/profesores/jane-naismith-iona","Iona demuestra un amplio conocimiento de los temas que se exponen en clase. Busca siempre que los estudiantes entiendan a profundidad y la metodología en grupos que utiliza es, a mi parecer, muy provechosa. Los temas que se ven son muy interesantes y, en general, la clase es muy amena desde donde se le mirePros: es fácil de dejar alta y se aprende muchísimoCons: en algunos temas se detiene demasiado, lo que puede hacer la clase algo monótona.","5"
"1576042785-18377","https://losestudiantes.co/","Charlotte De BeauvoirPeriodismo","https://losestudiantes.co/universidad-de-los-andes/periodismo/profesores/charlotte-de-beauvoir","De las peores profesoras que he tenido en la universidad, muy poco seria con sus clases (lee un papel en voz alta y esa es la clase), actividades que no generan ningún contenido ni aprendizaje
Una vez nos puso a actual la caída de las torres gemelas casi a modo de burla
Las lecturas podrían ser interesantes, pero la clase es muy mala y aburridaPros: monitoria antes de los parcialesCons: califica duro
parciales muy específicos","1.5"
"1576042788-18382","https://losestudiantes.co/","Karen RipollPsicología","https://losestudiantes.co/universidad-de-los-andes/psicologia/profesores/karen-ripoll","Una excelente profesora, es muy buena explicando los conceptos y teorías y se ve que prepara muy bien cada clase. Atiende cualquier duda que pueda surgir, es muy atenta con los estudiantes y recibe muy bien las críticas de clase. Realiza muchos ejercicios de juegos de roles y otras actividades que permiten una práctica real de lo aprendido. Pros: Muy organizada
Lecturas cortas","5"
"1576042790-18407","https://losestudiantes.co/","Monica Perez TrujilloPsicología","https://losestudiantes.co/universidad-de-los-andes/psicologia/profesores/monica-perez-trujillo","Es una profesora con amplios conocimientos sobre la materia, pero califica muy muy muy duro. No regala notas, los bonos, quices, talleres y actividades son difíciles de realizar y por eso toca leer con detalle.Pros: Explica con claridadCons: Califica muy duro","5"
"1576042790-18397","https://losestudiantes.co/","Monica Perez TrujilloPsicología","https://losestudiantes.co/universidad-de-los-andes/psicologia/profesores/monica-perez-trujillo","Mónica es una excelente profesora, sabe muchísimo de todo lo que explica y lo transmite en todas sus clases. Es muy puntual y también exigente con sus estudiantes, espera que en todas sus clases lleguen preparados y participen. Adicionalmente, es muy estricta calificando. Personalmente, aprendí mucho en su clase y me gustó demasiado todo lo que vimos, lo único que me disgustó es que el examen final, cuando vi la materia, fue prácticamente de memoria de todos los temas e incluso de algunas cosas que ella había dicho en clase. Pros: Clase muy interesante, se aprende muchísimo. Dan ganas de saber mucho más. Cons: Es muy exigente calificando y puede tener bastante carga académica para ser un cbu.","3.9"
"1576042936-18664","https://losestudiantes.co/","Diana Marcela Gomez CorrealCider","https://losestudiantes.co/universidad-de-los-andes/cider/profesores/diana-marcela-gomez-correal","Diana es una docente muy preparada y que conoce mucho del tema, le da un enfoque feminista a la clase, lo que vuelve el curso más interesante. Cuando se pone a leer diapositivas la clase se puede tornar tediosa, pero en general son actividades dinámicas.Pros: Hace muchas actividades dinámicas.
Los parciales son ensayos cortos que son relativamente fáciles de hacer.Cons: El tono de voz puede llegar a aburrir.","4.3"
"1576042743-18314","https://losestudiantes.co/","Andres Lorenzo Morales ReguerosPeriodismo","https://losestudiantes.co/universidad-de-los-andes/periodismo/profesores/andres-lorenzo-morales-regueros","Excelente.Pros: Clase interesante. Buena metodología. Calificación justoCons: Algo bravo. No debería delegar tanto la calificación de los trabajos","5"
"1576042788-18383","https://losestudiantes.co/","Karen RipollPsicología","https://losestudiantes.co/universidad-de-los-andes/psicologia/profesores/karen-ripoll","Sus clases teóricas pueden ser un poco lentas y aburridas pero sabe explicar bien los conceptos y se preocupa por las dudas que le surjan a los estudiantes. Realiza bastantes juegos de roles y talleres que hacen que la clase sea más dinámica. Se aprende mucho y hace que toda la teoría de la clase el estudiante la ponga en práctica. Pros: Empática, clase dinámica, busca mejorar su clase con base a la retroalimentación de los estudiantes.Cons: Algunas clases son un poco aburridas","4.5"
"1576042772-18341","https://losestudiantes.co/","Maria Alexis Martinez SeguraPsicología","https://losestudiantes.co/universidad-de-los-andes/psicologia/profesores/maria-alexis-martinez-segura","Solo vi aplicada con ella que dificilmente cuenta como una clase, pero es muy querida","4"
"1576042725-18287","https://losestudiantes.co/","Martin PackerPsicología","https://losestudiantes.co/universidad-de-los-andes/psicologia/profesores/martin-packer","Martin es uno de los peores profesores del departamento. Me molesta mucho que alguien, por ser buen investigador sea considerado como buen profesor porque no necesariamente una cosa lleva a la otra. Me parece que es irrespetuoso, engreido y prepotente en sus clases como profesor. Sus clases son de aprenderse todo de memoria sin reflexionar nunca y ...
Leer más...","1"
"1576042923-18650","https://losestudiantes.co/","William Jimenez LealPsicología","https://losestudiantes.co/universidad-de-los-andes/psicologia/profesores/william-jimenez-leal","Es un excelente investigador, muy buena persona pero un profesor un poco regular. Intenta innovar en sus clases y parciale poniendo temas divertidos o de actualidad pero a veces no le resulta muy bien pues el tema es bastante complejo. Es difícil seguirle el hilo en clase.Pros: Amabilidad, mucho recorrido en investigación, innovador. Cons: Parciales muy difíciles, talleres complejos. Difícil seguirle el hilo en clase.","3"
"1576042683-18237","https://losestudiantes.co/","Maria Jose AlvarezCiencias Sociales","https://losestudiantes.co/universidad-de-los-andes/ciencias-sociales/profesores/maria-jose-alvarez","Pros: - Excelente manejo de los temas. Es una persona que domina muy bien el contenido del curso y además aporta elementos de otros autores para enriquecer la clase.
- Se apoya mucho de su equipo de trabajo y trae invitados para que expliquen los temas, lo cual ayuda para obtener diferentes perspectivas.
- Se toma muy enserio el hecho de que el curso sea de escritura académica y da herramientas para mejorar en esta habilidad. Los ejercicios sobre los que hay que escribir los ensayos son muy interesantes.
- Ayuda mucho en el horario de atención.","5"
"1576042779-18360","https://losestudiantes.co/","Gary Alberto Cifuentes AlvarezEducación","https://losestudiantes.co/universidad-de-los-andes/educacion/profesores/gary-alberto-cifuentes-alvarez","Es un profesor muy organizado y califica de manera justa. Tiene buen manejo del tiempo y explica claramente.","5"
"1576042893-18632","https://losestudiantes.co/","Sandra Jimena Baez BuitragoPsicología","https://losestudiantes.co/universidad-de-los-andes/psicologia/profesores/sandra-jimena-baez-buitrago","Es Excelente profesora, explica muy bien y es muy interesante su clase, se aprende mucho!","4.9"
"1576042936-18665","https://losestudiantes.co/","Diana Marcela Gomez CorrealCider","https://losestudiantes.co/universidad-de-los-andes/cider/profesores/diana-marcela-gomez-correal","Muy buena profesora.","4.4"
"1576042923-18652","https://losestudiantes.co/","William Jimenez LealPsicología","https://losestudiantes.co/universidad-de-los-andes/psicologia/profesores/william-jimenez-leal","Es una excelente persona pero mal profesor, asume que todos los estudiantes saben del tema cuando nadie sabe de lo que habla. Aunque se preparen las lecturas y estar atento a la clase, no sirve porque hace parciales muy dificiles. Tiene estudiantes preferidos y no preferidos y se le nota mucho. Las monitoras son demasiado groseras y muy creidas, le...
Leer más...Pros: Es buena gente y atento.Cons: Es grosero con los estudiantes que no les va bien y asume que la gente ya sabe cuando un profesor no debe ser así. Confía mucho en sus monitoras aunque ellas son groseras y no atienden a los estudiantes.","2"
"1576042829-18510","https://losestudiantes.co/","Julio Eduardo Cruz VasquezPsicología","https://losestudiantes.co/universidad-de-los-andes/psicologia/profesores/julio-eduardo-cruz-vasquez","Tiene conocimiento sobre los temas pero no es un buen docente. Sus clases son aburridas y el contenido es muy pobre. El aprendizaje es casi nulo, hay que trabajar por su cuenta.","1"
"1576042801-18442","https://losestudiantes.co/","Sergio Samper De ZubiriaCiencias Sociales","https://losestudiantes.co/universidad-de-los-andes/ciencias-sociales/profesores/sergio-samper-de-zubiria","Uno de los mejores profesores de la universidad, sabe muy bien del tema y la forma en que dicta la clase la vuelve muy interesante. Es facil de dejarla alta. Genera muy buenas reflexiones, y las lecturas son muy pocas pero toca enfocarse mucho, para entender la lectura de principio a fin, que es lo que el profesor busca","5"
"1576042808-18453","https://losestudiantes.co/","Isabella GardeazabalPsicología","https://losestudiantes.co/universidad-de-los-andes/psicologia/profesores/isabella-gardeazabal","Isabella es super querida y es muy buena profesora. Sabe mucho de todo el tema de desarrollo de talento humano y como hacer que recursos humanos sea un socio estrategico para el negocio. Excelente clase para meter si se esta interesado en estos temas. Hace actividades muy cheveres para desarrollar habilidades de gerenciaPros: Es querida, buena profesora.Cons: Aveces puede ser un poco aburrida la clase.","4"
"1576042790-18395","https://losestudiantes.co/","Monica Perez TrujilloPsicología","https://losestudiantes.co/universidad-de-los-andes/psicologia/profesores/monica-perez-trujillo","Muy buena profesora, se nota que le fascina el tema y lo maneja al dedillo.","5"
"1576042794-18416","https://losestudiantes.co/","Fernando CardenasPsicología","https://losestudiantes.co/universidad-de-los-andes/psicologia/profesores/fernando-cardenas","Me parece que sabe demasiado y ademas sabe transmitir su conocimiento.Pros: En mi opinión me gusta mucho que enseñe en el tablero y no con diapositivasCons: sin embargo, este método dificulta el estudio para los parciales pues todo es con dibujos que son menos realistas a las imágenes que pone en los parciales","4"
"1576042725-18297","https://losestudiantes.co/","Martin PackerPsicología","https://losestudiantes.co/universidad-de-los-andes/psicologia/profesores/martin-packer","Martin es uno de los peores profesores del departamento. Me molesta mucho que alguien, por ser buen investigador sea considerado como buen profesor porque no necesariamente una cosa lleva a la otra. Me parece que es irrespetuoso, engreido y prepotente en sus clases como profesor. Sus clases son de aprenderse todo de memoria sin reflexionar nunca y eso me parece que no sirve. Hace presentaciones básicas de power point para sus clases, Muy pocas veces se generan discusiones interesantes, y las lecturas y el resto de material es básico y no se conecta de manera profunda, de análisis, en sus clases. No volvería a tomar clase con él pues sentí que fue una pérdida de tiempo.","1"
"1576042810-18456","https://losestudiantes.co/","Constanza Castro BenavidesCiencias Sociales","https://losestudiantes.co/universidad-de-los-andes/ciencias-sociales/profesores/constanza-castro-benavides","Es un amor de persona y en verdad le importa que sus estudiantes aprendan. No regala notas pero tampoco es muy dificil. No hay quizes. Pros: Siempre tiene buena actitud y explica bien. No es difícil","4.5"
"1576042721-18263","https://losestudiantes.co/","Enrique ChauxPsicología","https://losestudiantes.co/universidad-de-los-andes/psicologia/profesores/enrique-chaux","Muy bueno para esta materia, sabe mucho sobre Excel y SPSS, y es muy querido","4.7"
"1576042646-18195","https://losestudiantes.co/","Viviola Melida Gomez OrtizPsicología","https://losestudiantes.co/universidad-de-los-andes/psicologia/profesores/viviola-melida-gomez-ortiz","Viviola es una pésima profesora. Es supremamente rosquera, escuelera y súper aburridora. Lo único que se puede aprender en el curso viene de las lecturas y del trabajo individual que quiera hacer el estudiante porque en clase se pierde todo el tiempo con las mismas discusiones de la primera clase y con las mismas dinámicas. La clase es muy fácil po...
Leer más...Pros: Las lecturas obligatorias y complementarias son un buen marco de referencia para empezar a entender algunas perspectivas sobre las emociones. Cons: Aburrida, rosquera y muy escuelera. La clase es un fastidio con ella. Nada de profundidad en los temas que se deben ver.","1.5"
"1576042721-18273","https://losestudiantes.co/","Enrique ChauxPsicología","https://losestudiantes.co/universidad-de-los-andes/psicologia/profesores/enrique-chaux","El profesor sabe mucho de investigación. Creo que ha sido uno de mis mas importantes ejemplos a seguir.","5"
"1576042775-18352","https://losestudiantes.co/","Jorge BaxterEducación","https://losestudiantes.co/universidad-de-los-andes/educacion/profesores/Jorge-baxter","Jorge es un profesor increíble, yo diría que es el mejor profesor que he tenido en la universidad. Tiene gran pasión por los temas de clase y todavía mas por enseñarlos. Hace que la gente participe y que cada participación sea muy significativa. Yo ame la clase, PERO reconozco que tiene un nivel de inglés exigente en todas las áreas (el es muy comp...
Leer más...Pros: Hace actividades cheveres
Es muy comprensivo con las fechas (con tal de que uno no abuse)","5"
"1576042865-18605","https://losestudiantes.co/","Sandra Beatriz Sanchez LopezPeriodismo","https://losestudiantes.co/universidad-de-los-andes/periodismo/profesores/sandra-beatriz-sanchez-lopez","UNA CLASE EXCEPCIONAL!
De las mejores clases que he visto y fue la que dejo que mi semestre no fuera un total asco. Hacia el final del semestre que se leva al periodismo como tal se torna aburrido pero toda la primera mitad y parte de la segunda es fenomenal. Temáticas interesantes y una de las MEJORES PROFESORAS en al vida!. Sandra no solo hace qu...
Leer más...Pros: Sandra es increíble 
Temas interesantes 
Clase dinámica
Una vez hicimos como 8 min de yoga jajaja 
Monitoras muy queridas y ayudan mucho en todas las dudas que surgen 
Retroalimentación muy buena Cons: Los parciales pueden ser engañosos 
Si bien leer te contextualiza sus parciales son de lo que ella dice en clase","5"
"1576042844-18559","https://losestudiantes.co/","Matthieu De CastelbajacCiencias Sociales","https://losestudiantes.co/universidad-de-los-andes/ciencias-sociales/profesores/matthieu-de-castelbajac","Es una clase excesivamente sencilla ya que no hay parciales y solo se requiere asistencia a clase para pasar la materia. Matthieu es muy buen profesor pero al no ser nada exigente es muy fácil pasar la clase sin haber aprendido nada,Pros: Fácil
El profesor hace chistes para llamar la atención de los estudiantesCons: Nada exigente","3.6"
"1576042759-18329","https://losestudiantes.co/","Catalina Muñoz RojasCiencias Sociales","https://losestudiantes.co/universidad-de-los-andes/ciencias-sociales/profesores/catalina-mu%C3%B1oz-rojas","Catalina es una gran profesora. Se interesa por cada uno de sus estudiantes y explica todos sus temas de forma clara y divertida. Promueve el debate en su salón y está dispuesta a escuchar diferentes puntos de vista.

P.D. La clase que tome es la del CBU obligatorio. Pros: Amable
Explica bien
La clase es fácil Cons: La clase es fácil pero acumula muchos trabajos","5"
"1576042790-18398","https://losestudiantes.co/","Monica Perez TrujilloPsicología","https://losestudiantes.co/universidad-de-los-andes/psicologia/profesores/monica-perez-trujillo","Pros: Prepara muchos las clases.
Hace diferentes actividades.
Procura que todos participen.
Le da un aspecto crítico y ético a las clases.","4.9"
"1576042819-18477","https://losestudiantes.co/","Ana Lucia Jaramillo SierraPsicología","https://losestudiantes.co/universidad-de-los-andes/psicologia/profesores/ana-lucia-jaramillo-sierra","Ana Lucia es una muy buena profesora. Sabe mucho de los temas y siempre quiere ayudar a que se aprenda. Pros: - muy pendiente
- siempre incita a tener horas de consulta
- justa con las notas 
- muy queridaCons: - favoritismo
- trabajos en grupo","5"
"1576042630-18167","https://losestudiantes.co/","Patrick Dunstan Ingram GordonPsicología","https://losestudiantes.co/universidad-de-los-andes/psicologia/profesores/patrick-dunstan-ingram-gordon","Pros: fácilCons: es muy laxo","4.5"
"1576042683-18239","https://losestudiantes.co/","Maria Jose AlvarezCiencias Sociales","https://losestudiantes.co/universidad-de-los-andes/ciencias-sociales/profesores/maria-jose-alvarez","Maria José es sin duda una de las mejores profesoras que he tenido en mi vida, tiene mucho conocimiento del tema y pasión por la sociología, características que transmite facilmente a sus estudiantes. Es una persona muy amable, se preocupa por cada uno de sus estudiantes y su aprendizaje, para ella no existen preguntas tontas ni dudas demasiado básicas para explicar. 
Cuando metí Pensadores con ella me sentía muy intimidada al principio porque dicen que es una clase muy pesada y con conceptos difíciles de entender, había escuchado muchos compañeros que la vieron con otros profesores decir que era la peor clase del mundo. Sin embargo, con Maria José entendí todo perfectamente y dejé la nota muy alta, no hubo ni una sola clase aburrida o a la cual no quisiera asistir, además me inspiró a estudiar sociología como mi doble programa. Pros: Es muy amable y atenta a cualquier duda.
Se preocupa por el aprendizaje de sus estudiantes. 
Hace las clases muy amenas.
En las clases da herramientas sobre como realizar trabajos y lecturas los cuales facilitan el ser eficiente no solo en su materia sino en toda la vida universitaria.
La mejor profesora de la vida!","5"
"1576042923-18638","https://losestudiantes.co/","William Jimenez LealPsicología","https://losestudiantes.co/universidad-de-los-andes/psicologia/profesores/william-jimenez-leal","William es un profesor experto en temas de investigación cuantitativa y cognición. Pros: Es un profesor muy comprometido con lo que hace, le gusta que sus cursos sean de alta calidad y que exijan a los estudiantes pensar más allá de lo que creen que pueden. 
La clase de Diseño 2 puede ser un poco difícil de entender en un principio pero se aprende muchísimo. 
- Es muy comprensivo y flexible cuando sabe que el estudiante se lo merece.
- Se le facilita aprender los nombres de los estudiantes y esto hace la clase más próxima. Cons: Si ve que un estudiante es vago y desinteresado por su clase o en los trabajos que entrega tiende a exigirle mucho más, haciéndole preguntas en clase. 
- Puede ser muy sarcástico cuando un estudiante no le agrada mucho.
- Califica duro, y sus preguntas exigen un nivel de comprensión alto
- Puede ser difícil seguirle el hilo en clase, porque tiene una manera muy técnica y abstracta de hablar.","5"
"1576042844-18555","https://losestudiantes.co/","Matthieu De CastelbajacCiencias Sociales","https://losestudiantes.co/universidad-de-los-andes/ciencias-sociales/profesores/matthieu-de-castelbajac","Es la mejor clase que tuve en el semestre. Matthieu cuenta con una infinidad de conocimientos que sabe muy bien cómo comunicar con todos nosotros. Hace que autores tan difíciles de leer como lo es Marx, sean sencillos de comprender. Es muy gracioso y hace la clase amena. Su metodología de calificación es muy buena.Pros: No hay parciales, Foros muy fáciles, se preocupa por que uno entienda.
Es tan fácil como divertida.
Todo en el es estupendo.Cons: Exige asistencia y participación, pero no es algo muy malo.","5"
"1576042801-18437","https://losestudiantes.co/","Sergio Samper De ZubiriaCiencias Sociales","https://losestudiantes.co/universidad-de-los-andes/ciencias-sociales/profesores/sergio-samper-de-zubiria","Es una materia muy acertada, se muestra a Foucault y Popper de una manera muy bacana. Sergio es una eminencia y estuvo involucrado en la firma de la paz. Muy buena la clasePros: Es un buen profesor. 
Parciales tipo ensayo MUY FACILESCons: Casi no va a clase.","4.9"
"1576042829-18508","https://losestudiantes.co/","Julio Eduardo Cruz VasquezPsicología","https://losestudiantes.co/universidad-de-los-andes/psicologia/profesores/julio-eduardo-cruz-vasquez","Considero que la manera como dicta un tema tan diverso como es la psicología social, hace que se vuelva algo reduccionista. Por lo general la perspectiva que él acepta es la evolucionista y la mayoría de los argumentos que da se reducen a la biología. Aunque esta perspectiva es importante, creo que la psicología social va mucho más allá de esto y h...
Leer más...","2"
"1576042630-18168","https://losestudiantes.co/","Patrick Dunstan Ingram GordonPsicología","https://losestudiantes.co/universidad-de-los-andes/psicologia/profesores/patrick-dunstan-ingram-gordon","Pros: Es un profesor con mucho interés en los temas que dicta y muy atento con los estudiantes. Cons: Puede quedarse corto en la profundidad de las reflexiones de clase","3.3"
"1576042646-18197","https://losestudiantes.co/","Viviola Melida Gomez OrtizPsicología","https://losestudiantes.co/universidad-de-los-andes/psicologia/profesores/viviola-melida-gomez-ortiz","Viviola es una persona muy comprensiva y excelente profesora en cuanto a que sabe de qué está hablando. Sin embargo, ocurre que a lo largo del semestre tiende a desesperarse bastante al ver que los estudiantes no leen para su clase y no responde de forma adecuada a las preguntas que hace. Por lo cual, sus clases caen en una monotonía ya que se desespera al ver que sus estudiantes no se vinculan por más cambios y entusiasmo ella ponga de su parte. Con Viviola se debe buscar participar sin miedo si usted leyó, se dará cuenta que Viviola sabe muchísimo del tema y está dispuesta a discutir sobre los distintos enfoques. Reconoce muy bien el tema.Pros: Califican suave
Se apasiona por el tema
Lecturas interesantes y cortas en generalCons: Monotonía","5"
"1576042819-18480","https://losestudiantes.co/","Ana Lucia Jaramillo SierraPsicología","https://losestudiantes.co/universidad-de-los-andes/psicologia/profesores/ana-lucia-jaramillo-sierra","Demasiado querida, demasiado fácil y pone trabajos sobre películas o series lo cual hace que sea menos tedioso escribir ensayos para esta clase. Eso si, toca leer pero no es nada exagerado.","5"
"1576042725-18296","https://losestudiantes.co/","Martin PackerPsicología","https://losestudiantes.co/universidad-de-los-andes/psicologia/profesores/martin-packer","Es un académico muy importante en su campo, no obstante como profesor y como persona deja mucho que desear. me han dicho que lleva aquí en Colombia casi 8 años y aún no habla bien el español, a comparación con otros profesores extranjeros que llevan aquí menos tiempo y lo hablan mejor. Esta barrera del idioma hace la clase tediosa monótona y difíci...
Leer más...Pros: Sabe del temaCons: Grosero, irrespetuoso, pedante, no cumple con sus responsabilidades como profesor.","2"
"1576042837-18543","https://losestudiantes.co/","Yvonne Gomez MaquetPsicología","https://losestudiantes.co/universidad-de-los-andes/psicologia/profesores/yvonne-gomez-maquet","He visto tanto emoción como psicometría con ella y en ambas clases me gustó. A pesar de que a veces sus clases son monótonas y quizá tediosas si no te interesa el tema, es una buena profesora, sabe explicar muy bien, responde todas las dudas. Sus diapositivas son muchas pero para mi han sido una gran herramienta de estudio para los parciales.Pros: Es clara, atenta, respetuosa y amable con los estudiantes. 
Maneja bien el tema de la clase.Cons: No varía su metodología o forma de explicar","4"
"1576042885-18618","https://losestudiantes.co/","Efren Yesid Martínez OrtizPsicología","https://losestudiantes.co/universidad-de-los-andes/psicologia/profesores/efren-yesid-mart%C3%ADnez-ortiz","Pros: Es un profesor increíble, apasionado por lo que hace. Transmite mucha paz y enseña la teoría de una manera muy coherente con su personalidad.
Cons: En la clase se pueden llegar a tocar temas delicados, y seria bueno que los estudiantes y el profesor se conocieran para lograr una mejor experiencia.  A veces falta a clase porque viaja mucho","5"
"1576042893-18635","https://losestudiantes.co/","Sandra Jimena Baez BuitragoPsicología","https://losestudiantes.co/universidad-de-los-andes/psicologia/profesores/sandra-jimena-baez-buitrago","Cons: Es muy escuelera y el ritmo de la clase es muy acelerado.","3.3"
